{
  "id": "profile-1p0lars",
  "name": "韩晨",
  "headline": "意向：LLM-Agent实习生",
  "location": "北京市海淀区",
  "summary": "I am currently a Ph.D. student in a joint program between the School of Advanced Interdisciplinary Sciences and the Academy of Mathematics and Systems Science, Chinese Academy of Sciences, majoring in Computer Science and Technology. I am expected to graduate in 2028. My research interests focus on Large Language Models, Multi-Agent Systems, Misinformation Detection, and Knowledge Graph.",
  "personalWebsite": "https://hanshenmesen.github.io/",
  "personalWebsiteEvidence": [
    {
      "sourceId": "source-mijghs",
      "locator": "page:1",
      "excerpt": "hanshenmesen.github.io",
      "origin": "source"
    }
  ],
  "contacts": [
    "18155629731",
    "hanshenmesen@163.com",
    "个人网站: https://hanshenmesen.github.io/",
    "https://scholar.google.com/citations?user=Ep1bwMsAAAAJ"
  ],
  "identityEvidence": {
    "name": [
      {
        "sourceId": "source-mijghs",
        "locator": "page:1",
        "excerpt": "韩晨",
        "origin": "source"
      }
    ],
    "headline": [
      {
        "sourceId": "source-mijghs",
        "locator": "page:1",
        "excerpt": "意向：LLM-Agent实习生",
        "origin": "source"
      }
    ],
    "location": [
      {
        "sourceId": "source-mijghs",
        "locator": "page:1",
        "excerpt": "北京市海淀区",
        "origin": "source"
      }
    ],
    "summary": [
      {
        "sourceId": "source-1n2kp51",
        "locator": "line:4",
        "excerpt": "I am currently a Ph.D. student in a joint program between the School of Advanced Interdisciplinary Sciences and the Academy of Mathematics and Systems Science, Chinese Academy of Sciences, majoring in Computer Science and Technology. I am expected to graduate in 2028. My research interests focus on Large Language Models , Multi-Agent Systems , Misinformation Detection , and Knowledge Graph . Outside of research, I am also a Top 500 Tank player in Overwatch :D",
        "origin": "source"
      }
    ]
  },
  "contactEvidence": {
    "hanshenmesen@163.com": [
      {
        "sourceId": "source-mijghs",
        "locator": "page:1",
        "excerpt": "hanshenmesen@163.com",
        "origin": "source"
      }
    ],
    "https://scholar.google.com/citations?user=Ep1bwMsAAAAJ": [
      {
        "sourceId": "source-1n2kp51",
        "locator": "line:51",
        "excerpt": "Google Scholar: https://scholar.google.com/citations?user=Ep1bwMsAAAAJ",
        "origin": "source"
      }
    ],
    "18155629731": [
      {
        "sourceId": "source-mijghs",
        "locator": "page:1",
        "excerpt": "18155629731（微信同号）",
        "origin": "source"
      }
    ],
    "个人网站: https://hanshenmesen.github.io/": [
      {
        "sourceId": "source-mijghs",
        "locator": "page:1",
        "excerpt": "hanshenmesen.github.io",
        "origin": "source"
      }
    ]
  },
  "media": [
    {
      "url": "https://hanshenmesen.github.io/images/photo.png",
      "originalUrl": "images/photo.png",
      "sourcePage": "https://hanshenmesen.github.io/",
      "locator": "char:3690",
      "alt": "韩晨（Chen Han）",
      "title": "韩晨（Chen Han）",
      "kind": "profile",
      "category": "profile-photo",
      "categoryConfidence": 0.99,
      "categoryReason": "Explicit profile avatar candidate in profile container."
    },
    {
      "url": "https://hanshenmesen.github.io/images/aaai2026.png",
      "originalUrl": "images/aaai2026.png",
      "sourcePage": "https://hanshenmesen.github.io/",
      "locator": "char:7402",
      "alt": "sym",
      "title": "Beyond Detection: Exploring Evidence-based Multi-Agent Debate for Misinformation Intervention and Persuasion",
      "linkUrl": "https://arxiv.org/abs/2511.07267",
      "kind": "project",
      "category": "project-cover",
      "categoryConfidence": 0.98,
      "categoryReason": "Project block image."
    },
    {
      "url": "https://hanshenmesen.github.io/images/emnlp2025.png",
      "originalUrl": "images/emnlp2025.png",
      "sourcePage": "https://hanshenmesen.github.io/",
      "locator": "char:8224",
      "alt": "sym",
      "title": "Debate-to-Detect: Reformulating Misinformation Detection as a Real-World Debate with Large Language Models",
      "linkUrl": "https://aclanthology.org/2025.emnlp-main.764/",
      "kind": "project",
      "category": "project-cover",
      "categoryConfidence": 0.98,
      "categoryReason": "Project block image."
    },
    {
      "url": "https://hanshenmesen.github.io/images/cikm2025.png",
      "originalUrl": "images/cikm2025.png",
      "sourcePage": "https://hanshenmesen.github.io/",
      "locator": "char:8966",
      "alt": "sym",
      "title": "DocPolicyKG: A Lightweight LLM-Based Framework for Knowledge Graph Construction from Chinese Policy Documents",
      "linkUrl": "https://dl.acm.org/doi/10.1145/3746252.3760904",
      "kind": "project",
      "category": "project-cover",
      "categoryConfidence": 0.98,
      "categoryReason": "Project block image."
    }
  ],
  "skills": [
    "LLM Agent",
    "多智能体系统",
    "虚假信息识别",
    "自然语言处理",
    "知识图谱",
    "Python 程序设计",
    "机器学习",
    "LoRA 微调",
    "Graph-RAG",
    "Neo4J",
    "Milvus",
    "Scrapy",
    "BeautifulSoup",
    "OpenClaw",
    "LLM-as-a-Judge"
  ],
  "skillEvidence": {
    "LLM Agent": [
      {
        "sourceId": "source-mijghs",
        "locator": "page:1",
        "excerpt": "研究方向: LLM Agent, 多智能体系统, 虚假信息识别, 自然语言处理, 知识图谱",
        "origin": "source"
      }
    ],
    "多智能体系统": [
      {
        "sourceId": "source-mijghs",
        "locator": "page:1",
        "excerpt": "研究方向: LLM Agent, 多智能体系统, 虚假信息识别, 自然语言处理, 知识图谱",
        "origin": "source"
      }
    ],
    "虚假信息识别": [
      {
        "sourceId": "source-mijghs",
        "locator": "page:1",
        "excerpt": "研究方向: LLM Agent, 多智能体系统, 虚假信息识别, 自然语言处理, 知识图谱",
        "origin": "source"
      }
    ],
    "自然语言处理": [
      {
        "sourceId": "source-mijghs",
        "locator": "page:1",
        "excerpt": "研究方向: LLM Agent, 多智能体系统, 虚假信息识别, 自然语言处理, 知识图谱",
        "origin": "source"
      }
    ],
    "知识图谱": [
      {
        "sourceId": "source-mijghs",
        "locator": "page:1",
        "excerpt": "研究方向: LLM Agent, 多智能体系统, 虚假信息识别, 自然语言处理, 知识图谱",
        "origin": "source"
      }
    ],
    "Python 程序设计": [
      {
        "sourceId": "source-mijghs",
        "locator": "page:1",
        "excerpt": "主修课程: 人工智能, 数据挖掘, Python 程序设计, 自然语言处理, 机器学习",
        "origin": "source"
      }
    ],
    "机器学习": [
      {
        "sourceId": "source-mijghs",
        "locator": "page:1",
        "excerpt": "主修课程: 人工智能, 数据挖掘, Python 程序设计, 自然语言处理, 机器学习",
        "origin": "source"
      }
    ],
    "LoRA 微调": [
      {
        "sourceId": "source-mijghs",
        "locator": "page:1",
        "excerpt": "本地部署 DeepSeek-R1-7B 并进行 LoRA 微调，结合 Few-shot 等方法完成文档级信息抽取",
        "origin": "source"
      }
    ],
    "Graph-RAG": [
      {
        "sourceId": "source-mijghs",
        "locator": "page:1",
        "excerpt": "在Graph-RAG架构下，结合Neo4J图数据库和Milvus向量数据库实现并行检索与提示词拼接",
        "origin": "source"
      }
    ],
    "Neo4J": [
      {
        "sourceId": "source-mijghs",
        "locator": "page:1",
        "excerpt": "在Graph-RAG架构下，结合Neo4J图数据库和Milvus向量数据库实现并行检索与提示词拼接",
        "origin": "source"
      }
    ],
    "Milvus": [
      {
        "sourceId": "source-mijghs",
        "locator": "page:1",
        "excerpt": "在Graph-RAG架构下，结合Neo4J图数据库和Milvus向量数据库实现并行检索与提示词拼接",
        "origin": "source"
      }
    ],
    "Scrapy": [
      {
        "sourceId": "source-mijghs",
        "locator": "page:1",
        "excerpt": "集成Scrapy、BeautifulSoup、八爪鱼等爬虫工具，抓取数十万条来自烯牛、Arxiv、天眼查等平台的结构化数据",
        "origin": "source"
      }
    ],
    "BeautifulSoup": [
      {
        "sourceId": "source-mijghs",
        "locator": "page:1",
        "excerpt": "集成Scrapy、BeautifulSoup、八爪鱼等爬虫工具，抓取数十万条来自烯牛、Arxiv、天眼查等平台的结构化数据",
        "origin": "source"
      }
    ],
    "OpenClaw": [
      {
        "sourceId": "source-mijghs",
        "locator": "page:1",
        "excerpt": "基于 OpenClaw 与 Hermes 架构，对用户真实 Session Context 进行抽取建模",
        "origin": "source"
      }
    ],
    "LLM-as-a-Judge": [
      {
        "sourceId": "source-mijghs",
        "locator": "page:1",
        "excerpt": "结合多模型协同拆分、证据检索与 LLM-as-a-Judge 判定，实现最小语义原子级幻觉识别与加权汇总",
        "origin": "source"
      }
    ]
  },
  "items": [
    {
      "id": "summary-1p6usts",
      "kind": "summary",
      "title": "个人简介",
      "summary": "I am currently a Ph.D. student in a joint program between the School of Advanced Interdisciplinary Sciences and the Academy of Mathematics and Systems Science, Chinese Academy of Sciences, majoring in Computer Science and Technology. I am expected to graduate in 2028. My research interests focus on Large Language Models, Multi-Agent Systems, Misinformation Detection, and Knowledge Graph.",
      "bullets": [],
      "tags": [],
      "evidence": [
        {
          "sourceId": "source-mijghs",
          "locator": "page:1",
          "excerpt": "中国科学院-数学与系统科学研究院(硕士, 推免)-前沿交叉科学学院(博士)-计算机科学与技术 2023.09 - 2028.02 均分: 3.97/4.00 研究方向: LLM Agent, 多智能体系统, 虚假信息识别, 自然语言处理, 知识图谱",
          "origin": "source"
        },
        {
          "sourceId": "source-1n2kp51",
          "locator": "line:4",
          "excerpt": "I am currently a Ph.D. student in a joint program between the School of Advanced Interdisciplinary Sciences and the Academy of Mathematics and Systems Science, Chinese Academy of Sciences, majoring in Computer Science and Technology. I am expected to graduate in 2028. My research interests focus on Large Language Models , Multi-Agent Systems , Misinformation Detection , and Knowledge Graph . Outside of research, I am also a Top 500 Tank player in Overwatch :D",
          "origin": "source"
        }
      ],
      "fieldEvidence": {}
    },
    {
      "id": "education-1djg89o",
      "kind": "education",